{
  "customer_segment": "Small business owners (clinics, estate agents, and trades)",
  "pain_points": [
    "Missed calls leading to lost revenue",
    "Inconsistent customer follow-ups",
    "High cost of human receptionists"
  ],
  "evidence_sources": [
    "Trustpilot reviews of call-answering services",
    "Reddit threads on business call management",
    "Local business forums discussing missed leads"
  ],
  "pain_intensity_score": 9,
  "interview_count": 12
}